ID,REVIEW,LABEL,LENGTH,PREPROCESS,LENGTH_PRE
633,"Tadi saya mengunjungi outlet chatime di TP dan ditanya nomor member. Lalu saya berikan kartu fisik specialtea card ternyata sudah tidak berlaku dan diarahkan melalui aplikasi ini. Saya bertanya untuk poin nya bagaimana apakah bisa migrasi ke aplikasi. Kata kasir nya tidak bisa. Jadi poin di aplikasi nya juga 0 padahal udah capek2 ngumpulin poin ternyata dari kartu fisik ke aplikasi tidak terintegrasi. Setelah daftar di aplikasi ternyata ada nomor ID baru yg berbeda dengan nomor ID di kartu fisik. Saran saja lebih baik di aplikasi bisa input nomor member sendiri, untuk opsi kalau kasir males/gaptek/kurang informatif akhirnya dibilang tidak bisa.",3,652,tadi unjung outlet chatime tp tanya nomor member lalu ikan kartu fisik specialtea card nyata tidak laku arah lalu aplikasi tanya poin bagaimana migrasi aplikasi kata kasir tidak jadi poin aplikasi padahal udah capek ngumpulin poin nyata kartu fisik aplikasi tidak integrasi telah daftar aplikasi nyata nomor id baru beda nomor id kartu fisik saran lebih baik aplikasi input nomor member sendiri opsi kalau kasir males gaptek kurang informatif akhir bilang tidak,461
634,peraturan ongkir mie mapan barata jaya ini sebenarnya bgmn ya yg patent?,2,72,atur ongkir mie mapan barata jaya benar bgmn patent,51
635,Pelayanan yang memuaskan. Area dine in bersih,5,45,muas area dine bersih,21
636,"Pesan pakai aplikasi, pickup tinggal scan barcode dan ambil pesanan. Ga perlu menunggu lama, cukup ikut queue sesuai kedatangan di counter.",5,139,pesan pakai aplikasi pickup tinggal scan barcode ambil pesan ga perlu tunggu lama cukup ikut queue sesuai datang counter,120
637,"Nyaman buat nongkrong nggak terlalu bising n ramai, ada lapak iqos disini, area luar boleh utk iqos-an",5,102,nyaman buat nongkrong nggak terlalu bising ramai lapak iqos sini area luar utk iqosan,85
638,Cobain menu terbarunya Choco Black Forest dannnn enakk BANGETTTT,5,64,cobain menu baru choco black forest dannnn enakk bangetttt,58
639,"Masih cash only, kurang menghargai customer.",3,44,masih cash kurang harga customer,32
640,Cintailah produk produk dalam negri,4,35,cinta produk produk negri,25
641,Jutek casirnya. Ga ramah,1,24,jutek casirnya ga ramah,23
642,"Resto luass, service cepat dan ramah, makanan enak",5,50,resto luass service cepat ramah enak,36
643,"Cozy buat nongkrong di mall, antrian cepat",5,42,cozy buat nongkrong mall antri cepat,36
644,"Pelayanan oke, karyawan ramah",5,29,oke karyawan ramah,18
645,"Saya suka Green Milk tea, rasa tea nya tidak terlalu pahit, green tea nya terasa tapi tidak pekat dan pahit seperti kalau pakai black tea. Lebih segar. Pelayanan sangat baik, pada saat customer nanya2 dijelaskan dengan detail dan ramah. Proses pembuatannya juga cepat.",5,268,suka green milk tea rasa tea tidak terlalu pahit green tea asa tapi tidak pekat pahit kalau pakai black tea lebih segar sangat baik customer nanya jelas detail ramah proses buat cepat,183
646,Pegawai ramah,5,13,pegawai ramah,13
647,"Terletak dalam ruko. Pelayanan baik dan tempatnya nyaman .. Tersedia tempat duduk lantai 1 dan 2 untuk santai Parkir bayar, ada tukang parkir",5,141,letak ruko baik nyaman sedia duduk lantai santai parkir bayar tukang parkir,75
648,"Suka banget kesini. Suka banget sm minumannya, apalagi sama mba kasirnya",5,72,suka banget kesini suka banget sm apalagi sama mba kasir,56
649,"Pertama kali nyobain kopi kenangan karna belum pernah minum sama sekali,akhirnya download app kopi kenanhan dan dapet diskon 50% bagi pengguna baru murah banget sih. Nyobain kopi kenangan mantan less sugar ternyata enak banget berasa kopinya sedikit 8/10 dan cerita roti juga enak banget 8/10. Pelayanannya juga cepet,pegawainya juga ramah. Tingkatkan terus ya pelayanannya.",5,374,pertama kali nyobain kopi kenang karna belum pernah sama sekali akhir download app kopi kenanhan dapet diskon baru murah banget sih nyobain kopi kenang mantan less sugar nyata enak banget asa kopi sedikit cerita roti enak banget cepet pegawai ramah tingkat terus,262
650,"Tempatnya nyaman, pelayanannya ramah dan cepat",5,46,nyaman ramah cepat,18
651,"Suasana nyaman .makanan standar, minuman oke. Tp sy kecewa dg kentang gorengnya, seperti sdh tdk fresh dan bumbunya tdk sesuai selera sy",4,136,suasana nyaman standar oke tp sy kecewa dg kentang goreng sdh tdk fresh bumbu tdk sesuai selera sy,98
652,Makanannya enak dan tempatnya enak,5,34,enak enak,9
653,"iseng beli soalnya 18.000 an   yg favorit katanya yg berry ini eskrimnya.. jadi isinya dpt soft ice cream + stroberi jam + taburan putih ( gatau namanya ) + meringue ya untuk rasa lumayan enak, basic es krimnya ga yg manis bgt jadi masih pas, stroberi jamnya kerasa kecut seger manis & ga eneg jdnya   jadi ya 7.5/10 lah dengan harga 18.000 di mall tempat duduknya disini juga unik sih modelnya, tapi aq lupa foto   cukup nyaman lah buat ngobrol sm temen disini",4,461,iseng beli soal favorit kata berry eskrimnya jadi isi dpt soft ice cream stroberi jam tabur putih gatau nama meringue rasa lumayan enak basic es krim ga manis bgt jadi masih pas stroberi jam rasa kecut seger manis ga eneg jdnya jadi lah harga mall duduk sini unik sih model tapi aq lupa foto cukup nyaman lah buat ngobrol sm temen sini,335
654,Pelayanan sama seperti kopken cabang lain. Favoritnya tetap sama kopi kelapa,5,76,sama kopken cabang lain favorit tetap sama kopi kelapa,54
655,"LOCATION: Terletak di Jalan raya Manyar di sampingnya terdapat Kopi Kenangan Manyar, dan akses kesini cukup mudah dan banyak tempat parkir untuk kendaraan. VIBES: Tempatnya besar dan nyaman. cukup banyak meja yang tersedia. Indoor dan outdoor nya juga luas. AC-nya dingin sekali. SERVICE, TASTE & PRICE: Pelayanannya cepat dan ramah, self-service. Menunya seperti Starbucks pada umumnya. Harga masih terjangkau, terkadang ada promo melalui Line Apps, atau aplikasi Starbucks official nya. Pembayaran bisa QRIS atau tunai. FACILITIES: Tersedia WIFI dan kencang. Kamar mandi tersedia dan bersih. Ada banyak tempat charging di beberapa pojokan dinding dan meja sharing Panjang. Tidak ada Mushola. MORE REVIEW: Overall, salah satu my Favorite Starbucks di Surabaya dengan WIFI yang sangat bagus namun tempatnya sangat dingin   . Cocok banget untuk me time atau ramai-ramai dengan teman.",5,882,location letak jalan raya manyar samping kopi kenang manyar akses kesini cukup mudah banyak parkir kendara vibes besar nyaman cukup banyak meja sedia indoor outdoor luas acnya dingin sekali service taste price cepat ramah selfservice menu starbucks umum harga masih jangkau terkadang promo lalu line apps aplikasi starbucks official bayar qris tunai facilities sedia wifi kencang kamar mandi sedia bersih banyak charging beberapa pojok dinding meja sharing panjang tidak mushola review overall salah satu favorite starbucks surabaya wifi sangat bagus namun sangat dingin cocok banget time ramai teman,600
656,"Saya suka sambel nya .. makanannya juga mantap , cuman nota pembeliannya yg oret oretan .  Aduhh.. !!!",4,102,suka sambel mantap cuman nota beli oret oret aduhh,50
657,"Tolong untuk pihak gacoan. Itu jukirnya dikondisikan ya gausa kek preman maen foto foto orang karena gamau parkir? Parking: Juru parkirnya tolong untuk rambutnya gondrong itu dikondisikan gausa maen foto orang, Emang kenapa kalo difoto mas? Mau dicari dipukul kah?",1,264,tolong pihak gaco jukirnya kondisi gausa kek preman maen foto foto orang karena gamau parkir parking juru parkir tolong rambut gondrong kondisi gausa maen foto orang emang kenapa kalo foto mas mau cari pukul,207
658,Bertempat didalam mall Tunjungan Plaza 5 Surabaya dekat dengan outlet kosmetik. Tempatnya nyaman dan bersih. Enak banget untuk sekedar nongki bersama teman ataupun keluarga Pelayanannya ramah dan cepat. Recommended,5,214,mall tunjung plaza surabaya dekat outlet kosmetik nyaman bersih enak banget dar nongki sama teman keluarga ramah cepat recommended,130
659,Tempatnya kecil. Service ok.,3,28,kecil service,13
660,"tempatnya besar, nyaman, makanannya gausa diragukan lagi",5,56,besar nyaman gausa ragu,23
661,"Jumat jam 13:12 orderan banyak yang kerjain 1 orang, mana harus urus nota , bikin minuman, jadi bos jangan serakah!",1,115,jumat jam order banyak kerjain orang mana urus nota bikin jadi bos jangan serakah,81
662,"Setelah perjalanan jauh, bolehlah sekeluarga singgah disini.",5,60,telah jalan jauh keluarga singgah sini,38
663,"Yang cari mie mapan di mall bisa ke royal, di lantai food court yg paling bawah, dekat Hypermart. Pesannya pangsit mie bakwan porsi dewasa, dan menu barunya yg mie kuah gulai. Rasanya enak, tipikal tekstur mie yg tipis pipih. Untuk menu barunya, kuah gulainya enak gurih dan disajikan terpisah, namun ketika d campur dengan mienya, kurang terasa gurihnya, ada topping ayam krispinya, enak banget dan crunchy.",5,408,cari mie mapan mall royal lantai food court paling bawah dekat hypermart pesan pangsit mie bakwan porsi dewasa menu baru mie kuah gulai rasa enak tipikal tekstur mie tipis pipih menu baru kuah gulai enak gurih saji pisah namun campur mienya kurang asa gurih topping ayam krispinya enak banget crunchy,300
664,murah murah dan terjangkau harganya,5,35,murah murah jangkau harga,25
665,Menunggu dan menikmati .rasa sama .masih jadi paforit kopi ya kenangan tak terlupakan,5,85,tunggu nikmat rasa sama masih jadi paforit kopi kenang tak lupa,63
666,"Baru kali ini menemukan resto tidak bisa memilih tempat duduk sendiri alias mengikuti no yg di berikan kasir, tpi good ide agar tidak sembarangan org memilih tempat duduk sebelum memesan...",5,189,baru kali temu resto tidak pilih duduk sendiri alias ikut no ikan kasir tpi good ide tidak sembarang org pilih duduk belum mes,126
667,"Pegawainya ramah, peka banget waktu lagi cari nomer meja langsung gercep cariin dong",5,84,pegawai ramah peka banget waktu cari nomer meja langsung gercep cariin dong,75
668,"Menu favorit kalau disini itu Ovaltine Macchiato, no sugar dan less ice karena rasa susunya sudah agak manis. Cream macchiatonya ini enak banget, lembut, creamy dan manisnya pas. Lebih baik diminum langsung tanpa sedotan, ntar krimnya nempel di bibir kalian. Pelayanannya juga cepat dan tempat cafenya cozy.",4,307,menu favorit kalau sini ovaltine macchiato no sugar less ice karena rasa susu agak manis cream macchiatonya enak banget lembut creamy manis pas lebih baik langsung tanpa sedot ntar krim nempel bibir kalian cepat cafenya cozy,224
669,"santai enak buat kerja tugas, tapi harga parkir tidak standart",4,62,santai enak buat kerja tugas tapi harga parkir tidak standart,61
670,"Overall saya suka vibes nya, sofa ada, smoking room sendiri ada, cuma sayang pizza nya terlambat dtg ada 40 menit an menunggu.. juga sayang orange juice nya ngga asli buah itu aja..",4,181,overall suka vibes sofa smoking room sendiri cuma sayang pizza lambat dtg menit tunggu sayang orange juice ngga asli buah aja,125
671,"Cabang mie mapan terparah. Pelayanan super lama. Pesanan yang datang ada yang salah, padahal pelayan sudah konfirmasi ulang pesanan. Memaksa untuk diterima.",1,156,cabang mie mapan parah super lama pesan datang salah padahal konfirmasi ulang pesan paksa terima,96
672,"Rasa sambel pencitnya kurang asem, kurang segar sih, yg dominan aroma terasi dan rasanya cukup pedas, dan harganya bisa dibilang gak terlalu mahal untuk sekelas depot",4,166,rasa sambel cit kurang asem kurang segar sih dominan aroma terasi rasa cukup pedas harga bilang gak terlalu mahal kelas depot,125
673,Pelayanan nya lama bngat dan kurang sopan,1,41,lama bngat kurang sopan,23
674,"Padahal pas dateng blm close order (sekitar 21.20 kurang gitu keknya), tapi pembeli dateng kek ga suka gitu yee    jadi takut beli lagi ke outlet ini.",2,150,padahal pas dateng blm close order kurang gitu kek tapi beli dateng kek ga suka gitu yee jadi takut beli outlet,111
675,"staffnya ramah, pelayanan cepat. tempat dine in luas, ada smoking area juga. minumannya ya sama seperti outlet lain.",5,116,staffnya ramah cepat dine luas smoking area sama outlet lain,60
676,Nice spot buat ngopi outdoor vibes mall. Jam 5pm sudah sepi jadi nyaman buat ngopi sambil kerja di sini. Gak ada AC jadi cukup panas.,4,133,nice spot buat ngopi outdoor vibes mall jam pm sepi jadi nyaman buat ngopi kerja sini gak ac jadi cukup panas,109
677,"menyusahkan orang, kalau udah tutup, online nya juga ditutup woi Jangan tetap dibuka. mematikan rezeki orang lain",1,113,susah orang kalau udah tutup online tutup woi jangan tetap buka mati rezeki orang lain,86
678,pelayan tidak sopan,1,19,tidak sopan,11
679,"Mantap unit saya dapat istimewa, transaksi lancar berkat bantuan sales marketing mas sony dan team admin, sangat rekomended jual/beli mobil seken di berkat sejahtera, semoga unit saya awet   terima kasih",5,203,mantap unit istimewa transaksi lancar berkat bantu sales marketing mas sony team admin sangat rekomended jual beli mobil ken berkat sejahtera moga unit awet terima kasih,169
680,Sangat pas buat nongkrong malam mingguan,5,40,sangat pas buat nongkrong malam minggu,38
681,Pegawai malas dan tidak ramah. Pesanan sudah ready tidak ada yang manggil padahal tidak ada antrian,1,99,pegawai malas tidak ramah pesan ready tidak manggil padahal tidak antri,71
682,makanannya enak,5,15,enak,4
683,"Pelayanan sangat ramah, bersih, makanannya enak enak",5,52,sangat ramah bersih enak enak,29
684,Layanan lambat  katany resto super...  Driver dateng bru dbuat notany blm d apa2in... Padahal ngk antri,1,103,lambat katany resto super driver dateng bru dbuat notany blm apa padahal ngk antri,82
685,Blah...blah..blah..,3,19,blah blah blah,14
686,Tempat nongkrong minum kopi kalangan menengah ke atas,4,53,nongkrong kopi kalang tengah atas,33
687,bersih dan nyaman,5,17,bersih nyaman,13
688,"karyawannya baik, ramah, pelayanannya cepet juga, tempat nyaman pol dehh",5,72,karyawannya baik ramah cepet nyaman pol dehh,44
689,"kemarin pesan disini ayam bakar, ikan bakar, cah kangkung, sambel terasi, minuman jus alpukat, jus mangga, es degan dan lain lain, over all enak semua sih, pelayanan lumayan cepat tapi karena memang masih belum ada pengunjung lainnya, parkir cukup luas untuk 5-6 mobil. recommended Parking: parkir mobil 6",5,305,kemarin pesan sini ayam bakar ikan bakar cah kangkung sambel terasi jus alpukat jus mangga es degan lain lain all enak semua sih lumayan cepat tapi karena memang masih belum unjung lain parkir cukup luas mobil recommended parking parkir mobil,242
690,Mantapp seperti biasanya,5,24,mantapp biasa,13
691,"Tempat enak nyaman makanan enak, kopinya enak",5,45,enak nyaman enak kopi enak,26
692,Beli chatime parkir 10.000 lebih mahal parkirnya timbang chatimenya. Ngeri. Mosok ga ada kerjasama untuk pelanggn chatime yang parkir di depan apartemen nya.,1,157,beli chatime parkir lebih mahal parkir timbang chatimenya ngeri mosok ga kerjasama pelanggn chatime parkir depan apartemen,122
693,Pelayanan cepat,4,15,cepat,5
694,Enak tenan,5,10,enak tenan,10
695,"Tolong itu tukang parkir liarnya ditertibkan, masa SPBU ada tukang parkirnya? Udah kagak bantuin parkir, malah nyolot maksa bayar. Enak banget duduk-duduk dapet duit. Padahal dulu saya sering kesini kagak ada tukang parkirnya.",2,226,tolong tukang parkir liar tertib masa spbu tukang parkir udah kagak bantuin parkir malah nyolot maksa bayar enak banget duduk dapet duit padahal dulu sering kesini kagak tukang parkir,183
696,Excelco yang di Tp 6 ada indoor dan outdoor juga ya . Makanan yang dihidangkan sama rasa nya dengan excelco yang lain ya . Jangan membeli dengan gabung promo ya karena tidak bisa digabung.,5,188,excelco tp indoor outdoor hidang sama rasa excelco lain jangan beli gabung promo karena tidak gabung,100
697,"Sesuai standar Kopken umumnya Pelayanannya cepat karena kelihaian penjaga toko & minim antrean Ada tempat duduk juga Kelemahannya tidak tersedia stopkontak, jadi kalau mau kesini laptop harus sdh diisi daya/tidak rusak baterainya",4,229,sesuai standar kopken umum cepat karena lihai jaga toko minim antre duduk lemah tidak sedia stopkontak jadi kalau mau kesini laptop sdh isi daya tidak rusak baterai,164
698,"Lokasi strategis, makanan enak, ruangan lapang & menyenangkan , bisa beli oleh dibawa pulang",5,92,lokasi strategis enak ruang lapang senang beli bawa pulang,58
699,Tmpatnya sama Kya yg lain .....,5,31,tmpatnya sama kya lain,22
700,ANTRIAN DRIVER SHOPEE FOOD SUPER LAMA DARIPADA GACOAN AMBENGAN  !,1,65,antri driver shopee food super lama daripada gaco ambengan,58
701,Kopi enak dan nikmat,5,20,kopi enak nikmat,16
702,Bisa di percepat lagi kinerjanya...,2,35,cepat kerja,11
703,Semuanya bintang 5 termasuk harganya,5,36,semua bintang masuk harga,25
704,Space nya maybe di perbesar lg yah hehe,5,39,space maybe besar lg yah hehe,29
705,Ayamnya rada amis....harga agak mahal,2,37,ayam rada amis harga agak mahal,31
706,"Tempatnya nyaman dan bersih, pelayanannya juga cepat",5,52,nyaman bersih cepat,19
707,Nyaman buat santai..,5,20,nyaman buat santai,18
708,Cita rasa makanannya tidak perlu diragukan Pasti top markotop Cuma cukup dapat dikatakan cukup sesak juga,5,105,cita rasa tidak perlu ragu top markotop cuma cukup kata cukup sesak,67
709,"tempat tidak terlalu besar, dan kesannya sempit, kebersihan kurang harus nya sekelas resto wajib setiap saat memantau kebersihan agar lebih bersih dan nyaman untuk makan di tempat",4,179,tidak terlalu besar kesan sempit bersih kurang kelas resto wajib tiap pantau bersih lebih bersih nyaman,103
710,"Payment pakai gopay, server nya error.. disuruh bayar lagi, infonya segera diganti/ di transfer, sudah tanda tangan BAP segala macem sampe lebih dari sebulan uang 34ribu gak juga di transfer . Sayang bgt pdahal sering beli chatime tapi pelayanan manajemen nya sangat lambat",1,273,payment pakai gopay server error suruh bayar info segera ganti transfer tanda tangan bap segala macem sampe lebih bulan uang ribu gak transfer sayang bgt pdahal sering beli chatime tapi manajemen sangat lambat,209
711,Ini resto dapet rekor MURI..resto terlama sepanjang sejarah.. Sangat lelet2 sekali,1,82,resto dapet rekor muri resto lama panjang sejarah sangat lelet sekali,69
712,enaa pol suasananya nyamam banget buat nongki tipis tipis,5,57,enaa pol suasana nyamam banget buat nongki tipis tipis,54
713,Distracting,5,11,distracting,11
714,Tempatnya luas parkir aman,5,26,luas parkir aman,16
715,"Nyaman, aksesnya mudah karena dalam sogo, cuman sering bau rokok, padahal bukan smoking area",4,92,nyaman akses mudah karena sogo cuman sering bau rokok padahal bukan smoking area,80
716,"[LUPAKAN MANTAN, INGAT KOPI KENANGAN!] Brand KOPI yang satu ini tentunya sudah jadi ikon #KopiWajib untuk semua kalangan, bukan? Kehadiran KOPI KENANGAN di bidang minuman kopi berhasil meramaikan #KopiKekinian di Indonesia! #KopiKenangan didirikan pertama kali pada tahun 2017, dengan kedai pertama nya di kawasan Kuningan, Jakarta. Pada hari pertama jualan, bisa berhasil menjual 700 gelas kopi saja dan dalam waktu 2 tahun, KOPI KENANGAN telah membuka lebih dari 230 kedai di seluruh Indonesia! Ini #KopiKenanganMantan dari @kopikenangan.id yang aku beli di salah satu #ContainerKopi di Surabaya. Tenang saja, ada banyak #ContainerKopi yang tersebar di kota kamu untuk beli kopi favourite kamu, kok! So, check it out! Sudah minum KOPI KENANGAN, hari ini?",5,756,lupa mantan ingat kopi kenang brand kopi satu tentu jadi ikon kopiwajib semua kalang bukan hadir kopi kenang bidang kopi hasil ramai kopikekinian indonesia kopikenangan diri pertama kali tahun kedai pertama kawasan kuningan jakarta hari pertama jual hasil jual gelas kopi waktu tahun kopi kenang telah buka lebih kedai seluruh indonesia kopikenanganmantan kopikenangan id aku beli salah satu containerkopi surabaya tenang banyak containerkopi sebar kota kamu beli kopi favourite kamu kok check kopi kenang hari,510
717,Jos lahh,5,8,jos lahh,8
718,Oke juga tempatnya,5,18,oke,3
719,"Letaknya persis sebelahan sama Sbux. Cuman di sini aga gimana gitu secara lokasi, sekarang cukup terbantu dengan adanya free wifi kopi kenangan, dulu pas belum ada wifi susah sinyal (atau emang hp yang kentang)",5,210,letak persis belah sama sbux cuman sini aga gimana gitu cara lokasi sekarang cukup bantu free wifi kopi kenang dulu pas belum wifi susah sinyal emang hp kentang,160
720,"Selalu suka menu di mapan. Walo yg terkenal itu mie nya, tapi sambelan. Ya juga layak di coba",5,93,selalu suka menu mapan walo kenal mie tapi sambelan layak coba,62
721,Tempatnya di perempatan jalang..gampang terlihat di sebrang jalang,5,66,empat jalang gampang lihat sebrang jalang,41
722,Tolong buka tepat waktu ya. Saya bela-belain ke sini jam 7 pagi eh orangnya belum dateng. Mana di app & di pintu tulisannya tetep buka jam 7 pagi,2,145,tolong buka tepat waktu belabelain sini jam pagi eh orang belum dateng mana app pintu tulis tetep buka jam pagi,111
723,"wajib ke sini, no fake fake",5,27,wajib sini no fake fake,23
724,"Semua olahan ikannya enakk segerrr Pedes sambel nyaa pas, tempatnya nyaman dan cocok untuk acara kantor maupun keluarga. Toilet nyaa juga bersih, ada mushola juga. Untuk parkirnya lumayan luas.",5,193,semua olah ikan enakk segerrr pedes sambel nyaa pas nyaman cocok acara kantor maupun keluarga toilet nyaa bersih mushola parkir lumayan luas,140
725,"Tempatnya luas, parkir luas, bisa drive thru, 24 jam, penyajiannya cukup cepat, nyaman buat nongkrong lama.",4,107,luas parkir luas drive thru jam saji cukup cepat nyaman buat nongkrong lama,75
726,"tempat bagus, nyaman, dan makanannya enak",5,41,bagus nyaman enak,17
727,Kopi favorit pake banget,5,24,kopi favorit pake banget,24
728,Mantab tempatnya,5,16,mantab,6
729,Tetep pertahankan kualitasnya,5,29,tetep tahan kualitas,20
730,"Resto yang menyediakan pilihan menu olahan steak yang otentik. Tersedia berbagai varian menu steak sapi dan ayam. Harga steak bervariasi antara rentang 50-100ribu. Suasana yang cozy dan pelayanan yang ramah membuat resto ini menjadi langganan. Tersedia ruang khusus yang dapat disewa untuk acara seperti ulang tahun, engagement ataupun gathering. Jika ruang indoor penuh, masih tersedia area outdoor yang instagramable.",5,419,resto sedia pilih menu olah steak otentik sedia bagai varian menu steak sapi ayam harga steak variasi rentang ribu suasana cozy ramah buat resto jadi langgan sedia ruang khusus sewa acara ulang tahun engagement gathering ruang indoor penuh masih sedia area outdoor instagramable,278
731,Harganya murah kualitas terbaik tidak akan kalah saing dengan sb produk sebelah kalau ngopi disini. Pokoknya seneng banget ngopi disini pelayanannya juga ramah2 dan banyaknya standarisasi hiegenis dan all productnya hallal   juaraa daahh kopi kenangan. Terimakasih Kopi Kenangan,5,278,harga murah kualitas baik tidak kalah saing sb produk belah kalau ngopi sini pokok neng banget ngopi sini ramah banyak standar hiegenis all productnya hallal juaraa daahh kopi kenang terimakasih kopi kenang,206
732,"Chattime salah satu brand minuman favorit aku , dan coba beli di delta plaza ternyata pelayanan nya super duper ramah. Thank you buat mas mas chatime sudah kasih pelayanan yg oke banget",5,185,chattime salah satu brand favorit aku coba beli delta plaza nyata super duper ramah thank buat mas mas chatime kasih oke banget,127
733,"one of the most cozy chattime in town, tempatnya nyaman bgt buat ngobrol berlama2 sm teman ato pasangan.., adem, bersih, bnyk kursi.., dan ad bbrapa brand yg lain dsana (lebih cenderung k makanan)",5,196,one cozy chattime town nyaman bgt buat ngobrol berlama sm teman ato pasang adem bersih bnyk kursi ad bbrapa brand lain dsana lebih cenderung,140
734,Tempatnya nyaman..ini kali ke 5 saya makan disini lagi lagi karena ada undangan ulang tahun...alhamdlh. biasanya dapat tempat duduk di bagian depan..tapi kali ini dapat tempat duduk agak masuk.ke dalam..ternyata semakin ke dalam tempatnya semakin luas dan baguus..gak enggap..makanan udah pasti pas dilidah saya ya..pelayannya cepat tanggap dan sopan semua..saya suka,5,367,nyaman kali sini karena undang ulang tahun alhamdlh biasa duduk depan tapi kali duduk agak masuk nyata makin makin luas baguus gak enggap udah pas lidah cepat tanggap sopan semua suka,183
735,Sesuaikan jam buka Bilang jam 21.00 tapi 20.35 sudah tutup Buang buang waktu,1,76,sesuai jam buka bilang jam tapi tutup buang buang waktu,55
736,Minum kopi,5,10,kopi,4
737,"Tiap hari beli disini. Masukan kalau pagi tambah personil karena banyak customer antri, personilnya cuma 1. Pagi kan banyak orang berangkat kerja beli kopi dulu. Coba dipikirkan",4,177,tiap hari beli sini masuk kalau pagi tambah personil karena banyak customer antri personilnya cuma pagi kan banyak orang berangkat kerja beli kopi dulu coba pikir,162
738,Pelayanan cepat dan menawarkan aplikasi mobile apps memudahkan customer untuk pesan chatime,5,91,cepat tawar aplikasi mobile apps mudah customer pesan chatime,61
739,Kasir nya Kurang Ramah..,3,24,kasir kurang ramah,18
740,Menunya selalu sipppp,5,21,menu selalu sipppp,18
741,"Lagi haus beli Koi, kebetulan hari ini ada promo Combo, beli 2 hanya Rp.58.000, combo nya Mango yakult juice dan creamy matcha. Creamy matcha nya enak, ga terlalu manis, matcha nya terasa banget. Mango yakult juice nya manis banget padahal udah half sugar.",5,256,haus beli koi betul hari promo combo beli rp combo mango yakult juice creamy matcha creamy matcha enak ga terlalu manis matcha asa banget mango yakult juice manis banget padahal udah half sugar,193
742,Recomended,5,10,recomended,10
743,Parah kasirnya. SOP resto NGGAK TOTALITAS banget  ...!!! Seharusnya antrian 914...dikarenakan salah INPUT JADI MALAH ULANG ANTRI JADI 921. Udah tau pocc dapat orderaN ..jauh ... Costumer marah ngomel jadi kena bintang 1 turun bintang ...parah....!!!! Karena kelamaan ...busyiitt,1,278,parah kasir sop resto nggak totalitas banget antri karena salah input jadi malah ulang antri jadi udah tau pocc order jauh costumer marah ngomel jadi kena bintang turun bintang parah karena lama busyiitt,203
744,Bagus dan rame.,5,15,bagus rame,10
