ID,REVIEW,LABEL,LENGTH,PREPROCESS,LENGTH_PRE
447,"LOCATION: Lokasinya di Kawasan Graha Pena, Tempatnya sangat strategis di jalan Utama dan mudah ditemukan. Untuk akses tempat parkirnya sangat mudah karena gabung dengan manajemen parkir Graha Pena. VIBES: Tempatnya tidak terlalu besar, namun cukup ramai karena kawasan bisnis dan perkantoran. Tersedia indoor dan outdoor. AC-nya dingin. Tempatnya nyaman untuk produktif dan bersantai. SERVICE, TASTE & PRICE: Pelayanannya cepat dan ramah, self-service. Menunya seperti Starbucks pada umumnya. Harga masih terjangkau, terkadang ada promo melalui Line Apps, atau aplikasi Starbucks official nya. Pembayaran bisa QRIS atau tunai. FACILITIES: WIFI tersedia dan lumayan bagus. Tidak ada kamar Mandi, kamar mandi gabung dengan gedung Graha Pena, disebelah Tomoro Coffee. Ada lumayan banyak tempat charging di pojokan terutama dan sharing table. MORE REVIEW: Overall, salah satu Starbucks yang nyaman karena letaknya yang cukup strategis antara perbatasan Sidoarjo dan Surabaya jadi bisa jadi optional ketemu teman yang jangkauannya di tengah-tengah. Namun, parkir dikenakan biaya per jam, sehingga harganya meningkat seiring waktu.",5,1125,location lokasi kawasan graha pena sangat strategis jalan utama mudah temu akses parkir sangat mudah karena gabung manajemen parkir graha pena vibes tidak terlalu besar namun cukup ramai karena kawasan bisnis kantor sedia indoor outdoor acnya dingin nyaman produktif santa service taste price cepat ramah selfservice menu starbucks umum harga masih jangkau terkadang promo lalu line apps aplikasi starbucks official bayar qris tunai facilities wifi sedia lumayan bagus tidak kamar mandi kamar mandi gabung gedung graha pena belah tomoro coffee lumayan banyak charging pojok utama sharing table review overall salah satu starbucks nyaman karena letak cukup strategis batas sidoarjo surabaya jadi jadi optional ketemu teman jangkau tengah namun parkir kena biaya per jam harga tingkat iring waktu,794
448,Minuman cheze yg enak,5,21,cheze enak,10
449,kasir nya ramah dan makanan yang direkomendasikan juga enak,5,59,kasir ramah rekomendasi enak,28
450,Enak porsi banyak,4,17,enak porsi banyak,17
451,Karyawan nya . terlalu banyak ngobrol .. kususnya resto gindaco...  Tolong d perbaiki attitude karyawannya... Hargai konsumen..fokus bekerja... Bukan Mala ngobrol ajha ...mksih,1,176,karyawan terlalu banyak ngobrol sus resto gindaco tolong baik attitude karyawannya harga konsumen fokus kerja bukan mala ngobrol ajha mksih,139
452,pelayanannya bagus...dics nya banyakin yaa...hehe,5,49,bagus dics banyakin yaa hehe,28
453,"Service terburuk yang pernah aku experience, semua nya pada gak ad yang ngelayanin. Dipanggil tiga kali bilang mau mesen gak ad yang kembali padahal dari tadi ad customer baru datang langsung dilayani. Alhasil cuman duduk tanpa mesan karna bener  gak ad yang datang buat ngelayanin sama sekali, karyawan cuman plonga plongo!!!!",1,327,service buruk pernah aku experience semua gak ad ngelayanin panggil tiga kali bilang mau mesen gak ad padahal tadi ad customer baru datang langsung alhasil cuman duduk tanpa mesan karna bener gak ad datang buat ngelayanin sama sekali karyawan cuman plonga plongo,262
454,"kamar mandi bersih, parkir luas, minusnya gerah aja, waiters nya ada yg kurang ramah jg, overall 4/5",5,100,kamar mandi bersih parkir luas minus gerah aja waiters kurang ramah jg overall,78
455,Wah sok2 an ini excelso orang yg gundul..sumpah gak sopan sama customer...gak mau lah ke execlso sini  cr tmpat lain..,1,118,wah sok excelso orang gundul sumpah gak sopan sama customer gak mau lah execlso sini cr tmpat lain,98
456,"Pelayanan buruk, pegawai sangat tidak ramah",2,43,buruk pegawai sangat tidak ramah,32
457,The right place to gather and talk with friends,5,47,right place gather talk friends,31
458,Crew nya ramah2 banget,5,22,crew ramah banget,17
459,"Sesuai, harga & tempat",5,22,sesuai harga,12
460,Terjangkau semuanya,5,19,jangkau semua,13
461,Kasir menjelaskan promo dengan sangat jelas dan bnyk promo yg bikin irit di kantong,5,83,kasir jelas promo sangat jelas bnyk promo bikin irit kantong,60
462,Tolong untuk ibu IKA YULI PRATIWI... JIKA ANDA BEKERJA BEKERJALAH YANG BENAR JANGAN MENTANG-MENTANG ANDA PUNYA JABATAN SEENAKNYA SENDIRI.. KONCOMU KERJO DORONG SERAGAM CHATIME KERJA SENDIRI SEDANGKAN ANDA MALAH KETAWA NGAKAK DIBELAKANG KAN Tolong pihak chatime kasih sanksi yg sepantasnya,1,288,tolong ibu ika yuli pratiwi kerja kerja benar jangan mentang punya jabat enak sendiri konco kerjo dorong seragam chatime kerja sendiri sedang malah ketawa ngakak belakang kan tolong pihak chatime kasih sanksi pantas,215
463,Karyawannya baik dan ramah tempat nyaman bngt,5,45,karyawannya baik ramah nyaman bngt,34
464,pramusajinya rama,5,17,pramusaji rama,14
465,"Pelayanan cepet, tempat nyaman, bersihh bngt",5,44,cepet nyaman bersihh bngt,25
466,"siomay nya enak bangett murah lagi nebus jdi 9.000, dengan min pembbelian 60k dapet free coklat bar pula Kid-friendliness: makanan cocok untuk anak2 ada donat kecil isi 10biji, ada pancake souffle, ada siomay isi ayam, udang, jamur enak bangett anak-anak pada sukaa",5,265,siomay enak bangett murah nebus jdi min pembbelian dapet free coklat bar kidfriendliness cocok anak donat kecil isi biji pancake souffle siomay isi ayam udang jamur enak bangett anak sukaa,188
467,"Makanannya emang enak. Suasana sangat biasa saja, tidak ada yg menarik. Zonk, sy kira klo pake dinding kaca gedhe ada AC, ternyata AC rusak semua, cuma pake kipas angin.",3,169,emang enak suasana sangat biasa tidak tarik zonk sy kira klo pake dinding kaca gedhe ac nyata ac rusak semua cuma pake kipas angin,130
468,"Pelayanan bagus, cepat.",5,23,bagus cepat,11
469,Heeey mas2 yg jaga outlet chatime yg ramah ya looo.... Masak iya cuma beli satu doang malah di barengin sama gojek yg antriannya jauh di belakang aku.... Giliran di tanyain punya ku tinggal press kenapa gak di press lahhh malah bentak yg katanya duluan gojek.... Etikaaa looo yaaaaa sama mata melototin gua lagiii.... Loo pikir cuma loe doang kerja di bidang jasaaa... Kalau sudah di racik kenapa gak langsung di packing kenapa harus di kumpulinnnn.....,1,453,heeey mas jaga outlet chatime ramah looo masak iya cuma beli satu doang malah barengin sama gojek antri jauh belakang aku gilir tanyain punya ku tinggal press kenapa gak press lahhh malah bentak kata duluan gojek etikaaa looo yaaaaa sama mata melototin gua lagiii loo pikir cuma loe doang kerja bidang jasaaa kalau racik kenapa gak langsung packing kenapa kumpulinnnn,367
470,"Menu lychee series koi. Basicly ini teh sirup leci diberi topping krim machiatto di atasnya. Untuk rasa tehnya ok, masih ada pahit-pahitnya. Rasa lecinya malu-malu. Kalau ditambah buah leci asli mungkin lebih baik selain untuk nambah tekstur juga. Krim machiattonya enak, creamy dan lembut. Overall ini tidak begitu manis, jadi aman untuk orang yang kurang suka manis.",5,368,menu lychee series koi basicly teh sirup leci beri topping krim machiatto atas rasa teh masih pahit rasa leci malu kalau tambah buah leci asli mungkin lebih baik selain nambah tekstur krim machiattonya enak creamy lembut overall tidak begitu manis jadi aman orang kurang suka manis,281
471,"Sorry pelayanan lama , untuk online",1,35,sorry lama online,17
472,"Dulu ini tempat basecamp terenak sih kalo lg gabut malam2 sampe tengah malam dan dulu ac dilantai 3 dingin bgt,tp entah knp semakin kesini sampah yg dilantai 3 kalo udh penuh jarsng dilirik sama mungkin maintain lg acnya karena kadang yg gk suka ngerokok prefer di lt 3 dan kurang adem. Dan minusnya masih ada aja pelanggan yg gk mau bantu membuang sampahnya sendiri",4,366,dulu basecamp enak sih kalo lg gabut malam sampe tengah malam dulu ac lantai dingin bgt tp entah knp makin kesini sampah lantai kalo udh penuh jarsng lirik sama mungkin maintain lg acnya karena kadang gk suka ngerokok prefer lt kurang adem minus masih aja langgan gk mau bantu buang sampah sendiri,297
473,"Chatime atealier disini gabung 3 ya , chatime atealier , cupbap , dan gindaco disatu tempat. Sekarang poin chatime dijadiin satu di my fnb . Bisa ditukarkan dengan beli online di cupbap , atealier dan gindaco . Jadi tidak hanya bisa dipakai di chatime aja . Gindaconya lumayan enak ya , besar besar kemarin beli pakai poin dan dapat promo potongan 10rb . Cupbab nyobain toppokinya enak juga meskipun agak pedas untuk anak anak . Yang atealier kemarin cobain hazelnut enak dan gede banget .",5,489,chatime atealier sini gabung chatime atealier cupbap gindaco satu sekarang poin chatime dijadiin satu fnb tukar beli online cupbap atealier gindaco jadi tidak pakai chatime aja gindaconya lumayan enak besar besar kemarin beli pakai poin promo potong rb cupbab nyobain toppokinya enak meski agak pedas anak anak atealier kemarin cobain hazelnut enak gede banget,360
474,Tempatnya nyaman meskipun mungil. Bisa sambil kerja.. Kopinya enak n ga bikin kantong bolong. Cuma kurang colokan listrik... Hihihi...,5,134,nyaman meski mungil kerja kopi enak ga bikin kantong bolong cuma kurang colok listrik hihihi,92
475,Mendapatkan pengalaman tidak mengenakan dari pelayanan nya selama 1 jam makanan tidak keluar keluar dengan alasan tidak ke input padahal pelayan tau meja kami kosong tidak ada makanan mereka tidak mencoba untuk tanya apakah sudah pesan atau belum...atau ada makanan yang blum kluar....,1,285,alam tidak kena lama jam tidak keluar keluar alas tidak input padahal tau meja kosong tidak tidak coba tanya pesan belum blum kluar,131
476,"Tempatnya bersih,nyaman makin sore juga makin tenang makin asik buat me time :)",5,79,bersih nyaman makin sore makin tenang makin asik buat time,58
477,Pelayan asik,5,12,asik,4
478,tempatnya enak ada psnya,5,24,enak psnya,10
479,Cangkruk ngopi sek.....,4,23,cangkruk ngopi sek,18
480,keren bagus nyaman,5,18,keren bagus nyaman,18
481,Strategis dan bersih.pelayanan ramah,5,36,strategis bersih ramah,22
482,Untuk Rasa Seperti pada kopi kenangan lainnya Untuk pelayanan nya baik ramah dan Gercep Terima Kasih Sukses Selalu Buat Pemilik Kopi kenangan beserta Para Tim nya Salam Sukses dan Salam BOLBOLFAMS,4,196,rasa kopi kenang lain baik ramah gercep terima kasih sukses selalu buat milik kopi kenang tim salam sukses salam bolbolfams,123
483,Pesanan sesuai request,5,22,pesan sesuai request,20
484,"baru tahu ada menu es cream di chatime, rasa es cream nya enak aroma teh dan tidak terlalu manis,tidak mudah leleh meski saya makan ayam dulu masih tidak terlalu meleleh, tempat juga nyaman",5,189,baru tahu menu es cream chatime rasa es cream enak aroma teh tidak terlalu manis tidak mudah leleh meski ayam dulu masih tidak terlalu leleh nyaman,147
485,"Love it ! Bintang 5 buat rasa kopi yang kita pesan dan buat staffnya. Kita beli menu hot dan cold. Yg cold aku beli salted caramel iced coffee, rasanya gurih manis, manis caramel. Yg hot aku beli kopi houseblend dan susu. Mereka ramah dan sopan, juga membantu. Trimakasih sudah melayani dg baik. Baristanya sudah ramah, membantu plus good looking hehe    nyaman deh belinya. Trimakasih. Tempatnya rekomendasi take away deh. Klo buat dine-in gak ada tempat duduk yg cukup, dan juga gak ada meja. Untuk harga standar menurutku sekelas coffee shop. Menu yang ada kebanyakan pakai es atau cold drinks, tapi bisa juga dibuat hot drinks. Cuusss mampir ke sini dan pilih mau minum kopi apa heheh",5,688,love bintang buat rasa kopi pesan buat staffnya beli menu hot cold cold aku beli salted caramel iced coffee rasa gurih manis manis caramel hot aku beli kopi houseblend susu ramah sopan bantu trimakasih dg baik baristanya ramah bantu plus good looking hehe nyaman deh beli trimakasih rekomendasi take away deh klo buat dinein gak duduk cukup gak meja harga standar turut kelas coffee shop menu banyak pakai es cold drinks tapi buat hot drinks cuusss mampir sini pilih mau kopi apa heheh,485
486,"Pesanannya agak lama, tp sy maklumin soalnya ada promo bank mega jadi banyak cust yg borong, karyawan nya cuma 2",5,112,pesan agak lama tp sy maklumin soal promo bank mega jadi banyak cust borong karyawan cuma,89
487,Hmm mantapss,5,12,hmm mantapss,12
488,"Tempat nongkrong yang cozy, ac dingin, banyak colokan, dan minumannya enak  ada varian dessert dan cemilan asin. Jadi gak bingung mau nyemil apa. Tempat parkir untuk mobil areanya tidak banyak.",4,193,nongkrong cozy ac dingin banyak colok enak varian dessert cemilan asin jadi gak bingung mau nyemil apa parkir mobil area tidak banyak,133
489,Ada banyak promo menarik,5,24,banyak promo tarik,18
490,"Parah banget. Order di gojek pilih menu pickup di outlet eh ga boleh makan sambil duduk disitu. Bilangnya ga boleh bawa makan dari luar, lah kan makanan beli disitu ??? Iya kalau outlet kondisinya rame bgt gaada duduk trus kita maksa dicariin duduk, baru kita salah. Ini kondisi outlet sepi cuman 2 meja doang yang keisi. Sekedar duduk bentar aja ga boleh. Bahkan kata karyawannya buka kemasan take away yang dari excelso sendiri itu tidak boleh. Satu lagi, karyawan menjelaskan dengan tidak sopan. Cenderung mengusir.",1,518,parah banget order gojek pilih menu pickup outlet eh ga duduk situ bilang ga bawa luar lah kan beli situ iya kalau outlet kondisi rame bgt gaada duduk trus maksa dicariin duduk baru salah kondisi outlet sepi cuman meja doang isi dar duduk bentar aja ga bahkan kata karyawannya buka kemas take away excelso sendiri tidak satu karyawan jelas tidak sopan cenderung usir,366
491,Masnya kurang cekatan. Ngasirin pembelian under 50k itu memakan waktu > 10 menit hadeeh awal bayar mau pakai livin karena luamaaaaaaaaaaa jadinya mau bayar pakai uang tunai  eh tahu tahu bisa itu Livin  nya (mas nya blm pencet yes   hadeeeh mas ) Rasa Kopi standard kopken lah tapi pelayanan perlu di tingkat kan karyawan nya di training aja buat lebih paham soal kasir dan semua tool bayar nya. Lokasi strategis sekali.. cocok untuk take away kurang sesuai untuk dine in.,3,472,mas kurang cekat ngasirin beli waktu menit hadeeh awal bayar mau pakai livin karena luamaaaaaaaaaaa jadi mau bayar pakai uang tunai eh tahu tahu livin mas blm pencet yes hadeeeh mas rasa kopi standard kopken lah tapi perlu tingkat kan karyawan training aja buat lebih paham soal kasir semua tool bayar lokasi strategis sekali cocok take away kurang sesuai dine,360
492,"Pagi pagi tempat oleh olehnya sudah buka, tempatnya juga bersih, tersedia berbagai macam oleh oleh",5,98,pagi pagi buka bersih sedia bagai macam,39
493,Tak ramah,3,9,tak ramah,9
494,Gak suka nya karena terlalu lama prosesnya,2,42,gak suka karena terlalu lama proses,35
495,"Byk yg miss orderannya, luamaaa service nya poor    tdk sesuai difoto porsinya ...",2,82,byk miss order luamaaa service poor tdk sesuai foto porsi,57
496,Terimakasih kpd pak Rendi  atas pelayanannya  Boncafe Mantaap,5,61,terimakasih kpd pak rendi atas boncafe mantaap,46
497,"mau mereview tentang tukang parkir nya, sebenernya narik uang parkir tuh legal apa ilegal si. bnr2 tukang parkir nya nyebelin bgt, pemalak, premannn. pdahal walikota sby sudah menghimbau bahwa tdk boleh bayar parkir/menarik uang parkir kan?? lalu utk pegawai kopken apa tdk ada kewajiban sedikitpun kah untuk mengusir si tukang parkir??? (tanya aja) tadi ke kopken cuma beli dan take away pas dateng pun si TP (tukang parkir) gaada lah pas mau pulang dia nongol cuy. dia nanyain mau kemana ya kek basa basi gitu pgn dibayar parkir nya. trus ga aku jawab dia masih nanya lagii. dia mau nurunin tuh motor tp aku blg gausah bisa sendiri. ehh ga lama dia langsung saut aja tuh motor buat diturunin kesannya maksaaa gt lohh   . aku bingung harus bayar parkir gmn posisinya aku gaada cash. oh iya aku berdua ya, nah untung nih tmn ku ada cash 1000. si TP nagih  belum bayar  abistu tmnku ngasih sambil blg gaada uang lagi. ehh uang nya dibuang dongg di dpn kita dia sambil bilang  MOH GAK GELEM  sama ngomel2  ya kita takut dongg yauda kt langsung pergi aja jjrr takut bgt. sedih uang 1000 dibuang, pdhl buat anak kos itu sgtt butuhhh  . gmn ya ini apakah ada tanggapan dari pihak kopi kenangan mungkin berkenan untuk menanggapi",3,1222,mau mereview tukang parkir sebenernya narik uang parkir tuh legal apa ilegal si bnr tukang parkir nyebelin bgt malak premannn pdahal walikota sby menghimbau tdk bayar parkir tarik uang parkir kan lalu utk pegawai kopken apa tdk wajib sedikit usir si tukang parkir tanya aja tadi kopken cuma beli take away pas dateng si tp tukang parkir gaada lah pas mau pulang nongol cuy nanyain mau mana kek basa basi gitu pgn bayar parkir trus ga aku jawab masih nanya mau nurunin tuh motor tp aku blg gausah sendiri ehh ga lama langsung saut aja tuh motor buat diturunin kesan maksaaa gt lohh aku bingung bayar parkir gmn posisi aku gaada cash iya aku nah untung nih tmn ku cash si tp nagih belum bayar abistu tmnku ngasih blg gaada uang ehh uang buang dongg dpn bilang moh gak gelem sama ngomel takut dongg yauda kt langsung pergi aja jjrr takut bgt sedih uang buang pdhl buat anak kos sgtt butuhhh gmn tanggap pihak kopi kenang mungkin kenan tanggap,939
498,Enak mah ini tempatnya.. servicenya oke juga,5,44,enak mah servicenya oke,23
499,"Makyuss, mantab rasanya gak bakalan kecewan",5,43,makyuss mantab rasa gak bakal kecewan,37
500,Lokasi ada di dalam Superindo. Free Parking,5,43,lokasi superindo free parking,29
501,"Pelayan kurang bagus . Karyawan kurang ramah .kalau lagi tdk membeli , duduk sebentar aja di suruh pergi ...",1,108,kurang bagus karyawan kurang ramah kalau tdk beli duduk sebentar aja suruh pergi,80
502,Cocok buat nongki ampe pagii,5,28,cocok buat nongki ampe pagi,27
503,Saya pesan lewat gojek sudah 1 jam tidak selesai2 dan dari pihak driver gojek bilang dia udh nunggu dan menanyakan terus tapii pihak karyawan tetap tidak di gubris kalo memang tidak mengatasi jual online dan offline tidak usah mencantumkan di online,1,249,pesan lewat gojek jam tidak selesai pihak driver gojek bilang udh nunggu tanya terus tapi pihak karyawan tetap tidak gubris kalo memang tidak atas jual online offline tidak usah cantum online,191
504,"Alhamdulillah kopinya enak, baperista nya ramah, tempatnya comfortable, keep up the good work...",3,96,alhamdulillah kopi enak baperista ramah comfortable keep good work,66
505,"Pelayanan ramah, parkir mudah, luas dan ada tukang parkirnya, tempatnya nyaman, didalam ruangan sejuk dan dingin karena ada pendingin ruangannya. Lokasi cukup strategis berada dipinggir jalan, dan daerah padat penduduk. Tempatnya cocok banget buas nugas, belajar, diskusi, atau kerja. Pilihan menu banyak dan sangat variatif, ada kopi, non-kopi, dan roti. Kopinya enak menurutku dan harganya sangat affordable, tinggal dipilih aja karena pilihannya banyak. Ada toiletnya, disediakan tisu juga. Mungkin kurangnya nggak ada Mushola aja kali ya, jadi kalo mau Sholat harus keluar. Parking: Lokasi berada didepan kedai kopi, parkirannya luas, dan ada tukang parkirnya Kid-friendliness: Untuk anak-anak menurutku kurang cocok, karena memang suasana disini itu cocok buat nugas dan kerja gitu sih. Tapi bisa saja semisal anak-anak kesini. Wheelchair accessibility: Akses kursi roda seperti agak sulit, karena memang tidak disediakan khusus lokasi dan layanan untuk kursi roda",5,969,ramah parkir mudah luas tukang parkir nyaman ruang sejuk dingin karena dingin ruang lokasi cukup strategis pinggir jalan daerah padat duduk cocok banget buas nugas ajar diskusi kerja pilih menu banyak sangat variatif kopi nonkopi roti kopi enak turut harga sangat affordable tinggal pilih aja karena pilih banyak toilet sedia tisu mungkin kurang nggak mushola aja kali jadi kalo mau sholat keluar parking lokasi depan kedai kopi parkir luas tukang parkir kidfriendliness anak turut kurang cocok karena memang suasana sini cocok buat nugas kerja gitu sih tapi misal anak kesini wheelchair accessibility akses kursi roda agak sulit karena memang tidak sedia khusus lokasi kursi roda,680
506,Buruk banget kasir tidak ramah kantong es di kasih yang besar pdhl beli chat time lainya bisa kantong yang 4k aja ini dikasih 8k oblok oblok tanya promo lgsng sinis kasir nya,1,174,buruk banget kasir tidak ramah kantong es kasih besar pdhl beli chat time lai kantong aja kasih oblok oblok tanya promo lgsng sinis kasir,137
507,"sangat disayangkan parkir untuk driver online harus bayar, hasil terima order gak banyak,malah kena bayar parkir,, kecewa",1,121,sangat sayang parkir driver online bayar hasil terima order gak banyak malah kena bayar parkir kecewa,101
508,"Pelayanan cepat,memuaskan ,walaupun antri tapi tergolong cepat",5,62,cepat muas walaupun antri tapi golong cepat,43
509,Pelayanan buruk dan kurang sopan gak ada ramahnya terhadap ojol....kita driver beli gak MINTA,1,93,buruk kurang sopan gak ramah hadap ojol driver beli gak minta,61
510,"Mie nya khas banget, selalu ramai, tempat nyaman dan lokasi strategis",5,69,mie khas banget selalu ramai nyaman lokasi strategis,52
511,Banyak lalat,1,12,banyak lalat,12
512,"Udah lama gak ke mie mapan, semalam coba makan lagi dan pesan menu favorit yaitu penyetan otot. Lakok skrg cuma gajih yg di tepungi doang?? Ototnya mana? Sangat kecewa gak sepadan dgn harganya. Klo sambal mmg enak.",2,214,udah lama gak mie mapan malam coba pesan menu favorit penyet otot lakok skrg cuma gajih tepung doang otot mana sangat kecewa gak padan dgn harga klo sambal mmg enak,164
513,"Makanan ok semua, harga agak mahalan tapi sesuai dg harganya",5,60,semua harga agak mahal tapi sesuai dg harga,43
514,Lek garap orderan online Ojo. Penyetan tok seng d garap. Masio mie Yo garapen sesuai urutan,1,91,lek garap order online ojo penyet tok seng garap masio mie yo garapen sesuai urut,81
515,"Ini Chatime tapi versi mahalnya. Tapi bukan cuma harganya yang mahal ya, tempatnya juga beda, di sini tempat duduknya lebih nyaman. Porsi minumannya juga lebih besar. Jadi worth the price lah.",4,192,chatime tapi versi mahal tapi bukan cuma harga mahal beda sini duduk lebih nyaman porsi lebih besar jadi worth price lah,120
516,"Meja kotor, sisa air tumpah di kursi tdk dikeringkn, layanan barista buruk, cuek & tdk komunikatif ( tdk di info ada free croissant )",1,133,meja kotor sisa air tumpah kursi tdk dikeringkn barista buruk cuek tdk komunikatif tdk info free croissant,106
517,"Satu kekurangan kopi kenangan di mana aja berada.. Seperti kafe lainnya.. Ruang ber AC utk perokok ga ada.. Kl smoke hrs duduk di meja luar dan panas... Secara kopi kenangan mantannya mmg msh blm ada pesaingnya... Yg lain cenderung lbh manis.. Kalo kopken rasanya pas ga kemanisan, kopi itemnya (americano) jg enak yg hot dan tanpa gula lbh nendang...",4,351,satu kurang kopi kenang mana aja kafe lain ruang ber ac utk okok ga kl smoke hrs duduk meja luar panas cara kopi kenang mantan mmg msh blm saing lain cenderung lbh manis kalo kopken rasa pas ga manis kopi item americano jg enak hot tanpa gula lbh nendang,254
518,Tempatnya agak sempit karena memang rukonya kecil Pelayanan bagus Rasanya juga enak Pilihannya juga banyak Ada smoking areanya,4,126,agak sempit karena memang ruko kecil bagus rasa enak pilih banyak smoking area,78
519,"Sambelnya uwenak! Empal suwir sama sambel terongnya juga mantap. Kalo ayam bakarnya lumayan lah, tapi jatuhnya lebih kayak ayam bumbu aja soalnya ndak ada gosong2nya bakaran samsek Tapi masakan Warung Bu Kris rasanya mantap!",5,224,sambelnya uwenak empal suwir sama sambel terong mantap kalo ayam bakar lumayan lah tapi jatuh lebih kayak ayam bumbu aja soal ndak gosong bakar samsek tapi masakan warung bu kris rasa mantap,190
520,"Kalau hangout di Excelso Pakuwon City Mall, favorit kami outlet yang ini (posisi facade menghadap selatan), bukan yang timur. Kelebihannya, punya mezanin (lantai atas) dengan view yang ok banget buat kongkow, senyap dan mojok. Selain itu, ini cabang langsung milik PT. Kapal Api, bukan franchise. Minuman favorite tetap coffee float, sunda kelapa, sementara makannya carbonara dan platter. Service selalu ok di sini. All price tanpa service charge. Highly recommended. Vegetarian options: Various of salad Parking: Spacious yet comfort",5,535,kalau hangout excelso pakuwon city mall favorit outlet posisi facade hadap selatan bukan timur lebih punya mezanin lantai atas view banget buat kongkow senyap mojok selain cabang langsung milik pt kapal api bukan franchise favorite tetap coffee float sunda kelapa sementara carbonara platter service selalu sini all price tanpa service charge highly recommended vegetarian options various salad parking spacious yet comfort,423
521,Ramai antrian. Mungkin karena promo Jenius Rp. 7777,5,51,ramai antri mungkin karena promo jenius rp,42
522,"Kopi mantap, pelayanan bagus, tempat nya oke banget dengan musik klasik nya...",5,78,kopi mantap bagus oke banget musik klasik,41
523,"Dipaksa beli ukuran large atau paket, katanya cup reguler terbatas. Kalo cupnya terbatas urusan store lah masa saya",1,115,paksa beli ukur large paket kata cup reguler batas kalo cup batas urus store lah masa,85
524,Tempat nyaman dan pegawenya rama2,5,33,nyaman pegawenya rama,21
525,Map tidak sesuai dengan lokasi,1,30,map tidak sesuai lokasi,23
526,Tempat bersih dan nyaman,5,24,bersih nyaman,13
